<?xml version="1.0" encoding="UTF-8"?>
<workflow
	xmlns="http://smac.hefr.ch/archiver/workflow"
	xmlns:xsi="http://www.w3.org/2001/XMLSchema-instance"
	xsi:schemaLocation="http://smac.hefr.ch/archiver/workflow workflow.xsd">

	<meta>
		<name>Slideshow processing</name>
		<author>Jonathan Stoppani</author>
		<description>
			<p>Processes all uploaded PDF slideshow documents by extracting the page images.</p>
		</description>
	</meta>
	
	<trigger>
		<role is="slideshow"/>
		<extension is="pdf"/>
	</trigger>
	
	<task name="generate-images"
		class="smaclib.modules.archiver.tasks.GenerateImages"/>
</workflow>