<?xml version="1.0" encoding="UTF-8"?>
<workflow
	xmlns="http://smac.hefr.ch/archiver/workflow"
	xmlns:xsi="http://www.w3.org/2001/XMLSchema-instance"
	xsi:schemaLocation="http://smac.hefr.ch/archiver/workflow workflow.xsd">

	<meta>
		<name>Alignment processing</name>
		<author>Jonathan Stoppani</author>
		<description>
			<p>Processes all uploaded alignment files and moves them to the contrib root.</p>
		</description>
	</meta>
	
	<trigger>
		<role is="alignment"/>
		<extension is="xml"/>
	</trigger>
	
	<task name="move-to-root"
		class="smaclib.modules.archiver.tasks.archiveAlignment"/>
</workflow>